[
  {
    "id": "ch_60",
    "type": "read_order",
    "prompt": "Zet de zinnen in de juiste volgorde:",
    "orderItems": ["Eerst ga ik douchen.", "Daarna eet ik ontbijt.", "Tot slot ga ik naar werk."],
    "correctAnswer": "Eerst ga ik douchen.|Daarna eet ik ontbijt.|Tot slot ga ik naar werk."
  },
  {
    "id": "ch_61",
    "type": "read_order",
    "prompt": "Zet de stappen in de juiste volgorde:",
    "orderItems": ["Bel de huisarts.", "Maak een afspraak.", "Ga naar de praktijk."],
    "correctAnswer": "Bel de huisarts.|Maak een afspraak.|Ga naar de praktijk."
  },
  {
    "id": "ch_62",
    "type": "read_match",
    "context": "Lisa werkt in een supermarkt. Ze begint om 8 uur en stopt om 16 uur.",
    "prompt": "Match elke vraag met het juiste antwoord:",
    "matchLeft": ["Waar werkt Lisa?", "Hoe laat begint ze?", "Hoe laat stopt ze?"],
    "matchRight": ["In een supermarkt", "Om 8 uur", "Om 16 uur"],
    "correctAnswer": "ok"
  },
  {
    "id": "ch_63",
    "type": "word_order",
    "prompt": "Maak een goede zin:",
    "orderItems": ["de", "fiets", "is", "rood"],
    "correctAnswer": "de fiets is rood"
  },
  {
    "id": "ch_64",
    "type": "word_order",
    "prompt": "Maak een goede zin:",
    "orderItems": ["ik", "ga", "naar", "huis"],
    "correctAnswer": "ik ga naar huis"
  },
  {
    "id": "ch_66",
    "type": "image_describe",
    "prompt": "Beschrijf wat je ziet in één zin:",
    "imageUrl": "images/supermarket.svg",
    "correctAnswer": "Een man koopt brood in de supermarkt.",
    "acceptableAnswers": ["een man koopt brood", "iemand is in de winkel"]
  }
]
