[
  {
    "id": "a1.fundament-chpt04.boek.fill_blank",
    "type": "fill_blank",
    "prompt": "Het meervoud van boek is ___",
    "choices": ["boeken", "boek", "boeks"],
    "correctAnswer": "boeken",
    "tags": ["fundament", "chpt-04"]
  },
  {
    "id": "a1.fundament-chpt04.dag.fill_blank",
    "type": "fill_blank",
    "prompt": "Het meervoud van dag is ___",
    "choices": ["dagen", "dag", "dags"],
    "correctAnswer": "dagen",
    "tags": ["fundament", "chpt-04"]
  },
  {
    "id": "a1.fundament-chpt04.fiets.fill_blank",
    "type": "fill_blank",
    "prompt": "Het meervoud van fiets is ___",
    "choices": ["fietsen", "fiets", "fietss"],
    "correctAnswer": "fietsen",
    "tags": ["fundament", "chpt-04"]
  },
  {
    "id": "a1.fundament-chpt04.groep1.fill_blank",
    "type": "fill_blank",
    "prompt": "Groep 1: meervoud krijgt meestal ___",
    "choices": ["-en", "-s", "-es"],
    "correctAnswer": "-en",
    "tags": ["fundament", "chpt-04"]
  },
  {
    "id": "a1.fundament-chpt04.groep2.fill_blank",
    "type": "fill_blank",
    "prompt": "Groep 2: meervoud krijgt vaak ___",
    "choices": ["-s", "-en", "-eren"],
    "correctAnswer": "-s",
    "tags": ["fundament", "chpt-04"]
  },
  {
    "id": "a1.fundament-chpt04.huis.fill_blank",
    "type": "fill_blank",
    "prompt": "Het meervoud van huis is ___",
    "choices": ["huizen", "huis", "huiss"],
    "correctAnswer": "huizen",
    "tags": ["fundament", "chpt-04"]
  },
  {
    "id": "a1.fundament-chpt04.kind.fill_blank",
    "type": "fill_blank",
    "prompt": "Het meervoud van kind is ___",
    "choices": ["kinderen", "kind", "kinds"],
    "correctAnswer": "kinderen",
    "tags": ["fundament", "chpt-04"]
  },
  {
    "id": "a1.fundament-chpt04.stad.fill_blank",
    "type": "fill_blank",
    "prompt": "Het meervoud van stad is ___",
    "choices": ["steden", "stad", "stads"],
    "correctAnswer": "steden",
    "tags": ["fundament", "chpt-04"]
  }
]
