[
  {
    "id": "a1.kmb-chpt07.dokter-helpen.dialogue_reply",
    "type": "dialogue_reply",
    "prompt": "Goedemorgen mevrouw, wat kan ik voor u doen?",
    "choices": ["Ik heb hoofdpijn.", "Tot ziens en beterschap.", "Ik ga naar de apotheek."],
    "correctAnswer": "Ik heb hoofdpijn.",
    "tags": ["kmb", "chpt-07"]
  },
  {
    "id": "a1.kmb-chpt07.hoe-gaat.dialogue_reply",
    "type": "dialogue_reply",
    "prompt": "Hoi! Hoe gaat het?",
    "choices": ["Niet zo goed!", "Veel beterschap!", "Ja, dat mag."],
    "correctAnswer": "Niet zo goed!",
    "tags": ["kmb", "chpt-07"]
  },
  {
    "id": "a1.kmb-chpt07.wat-heb-je.dialogue_reply",
    "type": "dialogue_reply",
    "prompt": "Wat heb je?",
    "choices": ["Ik heb keelpijn.", "Tot ziens en sterkte.", "Ik zoek de bank."],
    "correctAnswer": "Ik heb keelpijn.",
    "tags": ["kmb", "chpt-07"]
  },
  {
    "id": "a1.kmb-chpt07.beterschap.dialogue_reply",
    "type": "dialogue_reply",
    "prompt": "Oh! Wat vervelend!",
    "choices": ["Veel beterschap!", "Ik heb rugpijn.", "Graag gedaan."],
    "correctAnswer": "Veel beterschap!",
    "tags": ["kmb", "chpt-07"]
  },
  {
    "id": "a1.kmb-chpt07.kom-binnen.dialogue_reply",
    "type": "dialogue_reply",
    "prompt": "Goedemiddag. Kom maar binnen. Ga maar zitten.",
    "choices": ["Ik voel me niet lekker!", "Tot ziens en beterschap.", "De weg is druk."],
    "correctAnswer": "Ik voel me niet lekker!",
    "tags": ["kmb", "chpt-07"]
  },
  {
    "id": "a1.kmb-chpt07.monique.read_mcq",
    "type": "read_mcq",
    "context": "Monique: Ik heb hoofdpijn.\nDokter: Hoelang hebt u al pijn?\nMonique: Al twee weken. Paracetamol helpt niet.\nDokter: Ik begrijp het, maar u moet het echt rustiger aan doen.",
    "prompt": "Wat zijn Moniques klachten en hoe lang al?",
    "choices": ["Hoofdpijn, al twee weken", "Keelpijn, al drie dagen", "Buikpijn, al twee weken"],
    "correctAnswer": "Hoofdpijn, al twee weken",
    "tags": ["kmb", "chpt-07"]
  },
  {
    "id": "a1.kmb-chpt07.maria.read_mcq",
    "type": "read_mcq",
    "context": "Maria: Ik heb al drie dagen keelpijn.\nDokter: Zeg eens AAA. Zucht eens diep.\nIk zie het al. U hebt keelontsteking. Ik geef u een recept voor medicijnen.\nMaria: Dank u wel dokter. Ik ga meteen naar de apotheek.",
    "prompt": "Wat heeft Maria en wat krijgt ze van de dokter?",
    "choices": ["Keelontsteking, een recept", "Hoofdpijn, een verwijsbrief", "Rugpijn, rust"],
    "correctAnswer": "Keelontsteking, een recept",
    "tags": ["kmb", "chpt-07"]
  },
  {
    "id": "a1.kmb-chpt07.pedro.read_mcq",
    "type": "read_mcq",
    "context": "Pedro: Ik heb al twee weken buikpijn.\nDokter: Alweer? Ik ga u onderzoeken.\nIk geef u een verwijsbrief voor het ziekenhuis.\nPedro: Dank u wel dokter. Ik zal een afspraak maken met de specialist.",
    "prompt": "Wat geeft de dokter aan Pedro?",
    "choices": [
      "Een verwijsbrief voor het ziekenhuis",
      "Een recept voor medicijnen",
      "Een afspraak bij de fysiotherapeut"
    ],
    "correctAnswer": "Een verwijsbrief voor het ziekenhuis",
    "tags": ["kmb", "chpt-07"]
  },
  {
    "id": "a1.kmb-chpt07.recept-apotheek.knm",
    "type": "knm",
    "prompt": "De dokter geeft je een recept voor medicijnen. Waar ga je naartoe?",
    "choices": ["De apotheek", "De gemeente", "Het station"],
    "correctAnswer": "De apotheek",
    "tags": ["kmb", "chpt-07"]
  },
  {
    "id": "a1.kmb-chpt07.verwijsbrief.knm",
    "type": "knm",
    "prompt": "Je hebt al twee weken buikpijn. De dokter geeft je een verwijsbrief. Waar ga je naartoe?",
    "choices": ["Het ziekenhuis", "De kledingwinkel", "De bushalte"],
    "correctAnswer": "Het ziekenhuis",
    "tags": ["kmb", "chpt-07"]
  },
  {
    "id": "a1.kmb-chpt07.fysio.knm",
    "type": "knm",
    "prompt": "Je hebt rugpijn. De dokter zegt: ga naar de fysiotherapeut. Heb je een verwijsbrief nodig?",
    "choices": [
      "Nee, je kunt zelf een afspraak maken",
      "Ja, altijd een verwijsbrief",
      "Nee, ga naar de apotheek"
    ],
    "correctAnswer": "Nee, je kunt zelf een afspraak maken",
    "tags": ["kmb", "chpt-07"]
  },
  {
    "id": "a1.kmb-chpt07.hoofdpijn.nl_to_en",
    "type": "nl_to_en",
    "prompt": "hoofdpijn",
    "choices": ["headache", "sore throat", "stomach ache"],
    "correctAnswer": "headache",
    "tags": ["kmb", "chpt-07"]
  },
  {
    "id": "a1.kmb-chpt07.hoofdpijn.fill_blank",
    "type": "fill_blank",
    "prompt": "Monique: Ik heb ___.",
    "choices": ["hoofdpijn", "keelpijn", "rugpijn"],
    "correctAnswer": "hoofdpijn",
    "tags": ["kmb", "chpt-07"]
  },
  {
    "id": "a1.kmb-chpt07.tanden-poetsen.fill_blank",
    "type": "fill_blank",
    "prompt": "Dan ___ je twee keer per dag je tanden poetsen!",
    "choices": ["moet", "mag", "zult"],
    "correctAnswer": "moet",
    "tags": ["kmb", "chpt-07"]
  }
]
