[
  {
    "id": "a1.fundament-chpt28.hulpwerkwoorden.fill_blank",
    "type": "fill_blank",
    "prompt": "Hulpwerkwoorden voltooide tijd: zijn en ___",
    "choices": [
      "hebben",
      "worden",
      "zullen"
    ],
    "correctAnswer": "hebben",
    "tags": [
      "fundament",
      "chpt-28"
    ]
  },
  {
    "id": "a1.fundament-chpt28.gaan-verleden.verb_form",
    "type": "verb_form",
    "prompt": "Ik ___ gisteren naar school.",
    "choices": [
      "ging",
      "ga",
      "gaat"
    ],
    "correctAnswer": "ging",
    "tags": [
      "fundament",
      "chpt-28"
    ]
  },
  {
    "id": "a1.fundament-chpt28.hebben-voltooid.verb_form",
    "type": "verb_form",
    "prompt": "Wij ___ het al gedaan.",
    "choices": [
      "hebben",
      "heeft",
      "had"
    ],
    "correctAnswer": "hebben",
    "tags": [
      "fundament",
      "chpt-28"
    ]
  },
  {
    "id": "a1.fundament-chpt28.moeten.verb_form",
    "type": "verb_form",
    "prompt": "Ik ___ naar huis.",
    "choices": [
      "moet",
      "mogen",
      "moeten"
    ],
    "correctAnswer": "moet",
    "tags": [
      "fundament",
      "chpt-28"
    ]
  },
  {
    "id": "a1.fundament-chpt28.zijn-voltooid.verb_form",
    "type": "verb_form",
    "prompt": "Zij ___ ziek geweest.",
    "choices": [
      "is",
      "was",
      "heeft"
    ],
    "correctAnswer": "is",
    "tags": [
      "fundament",
      "chpt-28"
    ]
  }
]
