[
  {
    "id": "a1.kmb-chpt03.tot-woensdag.dialogue_reply",
    "type": "dialogue_reply",
    "prompt": "Twee uur is goed. Ik heb er zin in!",
    "choices": ["Ik ook! Tot woensdag!", "Ik werk 40 uur.", "Helaas, geen tijd."],
    "correctAnswer": "Ik ook! Tot woensdag!",
    "tags": ["kmb", "chpt-03"]
  },
  {
    "id": "a1.kmb-chpt03.wie-gaat-mee.dialogue_reply",
    "type": "dialogue_reply",
    "prompt": "Hé jongens, ik wil volgende week naar de stad gaan. Wie gaat er mee?",
    "choices": ["Ik wil graag naar de stad, Maria.", "Ik werk deze week 40 uur.", "De bus is om twee uur."],
    "correctAnswer": "Ik wil graag naar de stad, Maria.",
    "tags": ["kmb", "chpt-03"]
  },
  {
    "id": "a1.kmb-chpt03.woensdag.nl_to_en",
    "type": "nl_to_en",
    "prompt": "woensdag",
    "choices": ["Wednesday", "Friday", "Sunday"],
    "correctAnswer": "Wednesday",
    "tags": ["kmb", "chpt-03"]
  },
  {
    "id": "a1.kmb-chpt03.today.en_to_nl",
    "type": "en_to_nl",
    "prompt": "today",
    "choices": ["vandaag", "morgen", "gisteren"],
    "correctAnswer": "vandaag",
    "tags": ["kmb", "chpt-03"]
  },
  {
    "id": "a1.kmb-chpt03.vraagwoord-wanneer.fill_blank",
    "type": "fill_blank",
    "prompt": "___ gaan we naar het werk? Om 8 uur.",
    "choices": ["Wanneer", "Waar", "Welke"],
    "correctAnswer": "Wanneer",
    "tags": ["kmb", "chpt-03"]
  },
  {
    "id": "a1.kmb-chpt03.stad-afspraak.read_mcq",
    "type": "read_mcq",
    "context": "Maria wil naar de stad. Irene heeft geen tijd: zij werkt 40 uur. Monique gaat mee. Maria en Monique ontmoeten elkaar om twee uur. Monique komt met de bus.",
    "prompt": "Hoe laat ontmoeten Maria en Monique elkaar?",
    "choices": ["Om twee uur", "Om acht uur", "Om zes uur"],
    "correctAnswer": "Om twee uur",
    "tags": ["kmb", "chpt-03"]
  },
  {
    "id": "a1.kmb-chpt03.pablo-donderdag.read_mcq",
    "type": "read_mcq",
    "context": "Pablo sport op donderdag 's ochtends. 's Middags is hij thuis met zijn kinderen. Van vrijdag tot zondag gaat hij een weekend naar Groningen.",
    "prompt": "Wat doet Pablo op donderdagmiddag?",
    "choices": ["Hij is thuis met zijn kinderen", "Hij sport 's ochtends", "Hij gaat naar Groningen"],
    "correctAnswer": "Hij is thuis met zijn kinderen",
    "tags": ["kmb", "chpt-03"]
  },
  {
    "id": "a1.kmb-chpt03.week-dagen.read_mcq",
    "type": "read_mcq",
    "context": "Een week heeft zeven dagen: maandag, dinsdag, woensdag, donderdag, vrijdag, zaterdag, zondag.",
    "prompt": "Hoeveel dagen heeft een week?",
    "choices": ["Zeven", "Twaalf", "Vierentwintig"],
    "correctAnswer": "Zeven",
    "tags": ["kmb", "chpt-03"]
  },
  {
    "id": "a1.kmb-chpt03.dag-uren.number_detail",
    "type": "number_detail",
    "context": "Een dag heeft vierentwintig uren.",
    "prompt": "Hoeveel uren heeft een dag?",
    "choices": ["24 uur", "7 uur", "12 uur"],
    "correctAnswer": "24 uur",
    "tags": ["kmb", "chpt-03"]
  },
  {
    "id": "a1.kmb-chpt03.cursus-lessen.number_detail",
    "type": "number_detail",
    "context": "Hoeveel lessen heeft de cursus? De cursus heeft 13 lessen.",
    "prompt": "Hoeveel lessen heeft de cursus?",
    "choices": ["13 lessen", "7 lessen", "24 lessen"],
    "correctAnswer": "13 lessen",
    "tags": ["kmb", "chpt-03"]
  },
  {
    "id": "a1.kmb-chpt03.gisteren-dag.knm",
    "type": "knm",
    "prompt": "Vandaag is het maandag. Welke dag was het gisteren?",
    "choices": ["Zondag", "Dinsdag", "Woensdag"],
    "correctAnswer": "Zondag",
    "tags": ["kmb", "chpt-03"]
  },
  {
    "id": "a1.kmb-chpt03.boodschappen.knm",
    "type": "knm",
    "prompt": "'s Middags gaan we boodschappen doen. Waar doen we boodschappen?",
    "choices": ["In de supermarkt", "In de keuken", "Op maandag"],
    "correctAnswer": "In de supermarkt",
    "tags": ["kmb", "chpt-03"]
  }
]