[
  {
    "id": "a1.grammar.thuis-blijven.fill_blank",
    "type": "fill_blank",
    "prompt": "Ik blijf thuis ___ ik ziek ben.",
    "choices": ["omdat", "maar", "en"],
    "correctAnswer": "omdat"
  },
  {
    "id": "a1.grammar.fiets-rood.fill_blank",
    "type": "fill_blank",
    "prompt": "___ fiets is rood.",
    "choices": ["De", "Het", "Een"],
    "correctAnswer": "De"
  },
  {
    "id": "a1.grammar.ga-werk.verb_form",
    "type": "verb_form",
    "prompt": "Ik ___ elke dag naar mijn werk.",
    "choices": ["ga", "gaat", "gaan"],
    "correctAnswer": "ga"
  },
  {
    "id": "a1.grammar.woont-amsterdam.verb_form",
    "type": "verb_form",
    "prompt": "Zij ___ in Amsterdam.",
    "choices": ["woont", "woon", "wonen"],
    "correctAnswer": "woont"
  },
  {
    "id": "a1.grammar.boek-tafel.preposition",
    "type": "preposition",
    "prompt": "Het boek ligt ___ de tafel.",
    "choices": ["op", "in", "naar"],
    "correctAnswer": "op"
  },
  {
    "id": "a1.grammar.supermarkt.preposition",
    "type": "preposition",
    "prompt": "Ik ga ___ de supermarkt.",
    "choices": ["naar", "op", "uit"],
    "correctAnswer": "naar"
  }
]