[
  {
    "id": "a1.fundament-chpt08.dik.nl_to_en",
    "type": "fill_blank",
    "prompt": "Het tegenovergestelde van dik is ___",
    "choices": [
      "dun",
      "dikker",
      "zwaar"
    ],
    "correctAnswer": "dun",
    "tags": [
      "fundament",
      "chpt-08"
    ]
  },
  {
    "id": "a1.fundament-chpt08.goed.nl_to_en",
    "type": "fill_blank",
    "prompt": "Het tegenovergestelde van goed is ___",
    "choices": [
      "slecht",
      "beter",
      "mooi"
    ],
    "correctAnswer": "slecht",
    "tags": [
      "fundament",
      "chpt-08"
    ]
  },
  {
    "id": "a1.fundament-chpt08.groot.nl_to_en",
    "type": "fill_blank",
    "prompt": "Het tegenovergestelde van groot is ___",
    "choices": [
      "klein",
      "groter",
      "lang"
    ],
    "correctAnswer": "klein",
    "tags": [
      "fundament",
      "chpt-08"
    ]
  },
  {
    "id": "a1.fundament-chpt08.hoog.nl_to_en",
    "type": "fill_blank",
    "prompt": "Het tegenovergestelde van hoog is ___",
    "choices": [
      "laag",
      "diep",
      "breed"
    ],
    "correctAnswer": "laag",
    "tags": [
      "fundament",
      "chpt-08"
    ]
  },
  {
    "id": "a1.fundament-chpt08.lang.nl_to_en",
    "type": "fill_blank",
    "prompt": "Het tegenovergestelde van lang is ___",
    "choices": [
      "kort",
      "langer",
      "smal"
    ],
    "correctAnswer": "kort",
    "tags": [
      "fundament",
      "chpt-08"
    ]
  },
  {
    "id": "a1.fundament-chpt08.mooi.nl_to_en",
    "type": "fill_blank",
    "prompt": "Het tegenovergestelde van mooi is ___",
    "choices": [
      "lelijk",
      "mooier",
      "goed"
    ],
    "correctAnswer": "lelijk",
    "tags": [
      "fundament",
      "chpt-08"
    ]
  },
  {
    "id": "a1.fundament-chpt08.nieuw.nl_to_en",
    "type": "fill_blank",
    "prompt": "Het tegenovergestelde van nieuw is ___",
    "choices": [
      "oud",
      "nieuwer",
      "jong"
    ],
    "correctAnswer": "oud",
    "tags": [
      "fundament",
      "chpt-08"
    ]
  },
  {
    "id": "a1.fundament-chpt08.warm.nl_to_en",
    "type": "fill_blank",
    "prompt": "Het tegenovergestelde van warm is ___",
    "choices": [
      "koud",
      "warm",
      "heet"
    ],
    "correctAnswer": "koud",
    "tags": [
      "fundament",
      "chpt-08"
    ]
  }
]