[
  {
    "id": "a1.kmb-chpt04.bus-te-laat.dialogue_reply",
    "type": "dialogue_reply",
    "prompt": "Hoi Monique, met Maria. Waar ben je?",
    "choices": [
      "Sorry! Mijn bus is te laat. Ik ben om kwart over twee in de stad.",
      "Ik wil graag thee.",
      "Tot volgende week!"
    ],
    "correctAnswer": "Sorry! Mijn bus is te laat. Ik ben om kwart over twee in de stad.",
    "tags": ["kmb", "chpt-04"]
  },
  {
    "id": "a1.kmb-chpt04.hoe-laat.dialogue_reply",
    "type": "dialogue_reply",
    "prompt": "Hoe laat is het?",
    "choices": ["Het is twee uur.", "Het is maandag.", "Ik woon in Huizen."],
    "correctAnswer": "Het is twee uur.",
    "tags": ["kmb", "chpt-04"]
  },
  {
    "id": "a1.kmb-chpt04.markt-kopen.dialogue_reply",
    "type": "dialogue_reply",
    "prompt": "Wat wil jij doen? Wil je iets drinken? Of wil je iets kopen?",
    "choices": [
      "Ik wil graag een paar dingen kopen op de markt.",
      "Mijn bus is te laat.",
      "Ik ga om half vijf naar de sportschool."
    ],
    "correctAnswer": "Ik wil graag een paar dingen kopen op de markt.",
    "tags": ["kmb", "chpt-04"]
  },
  {
    "id": "a1.kmb-chpt04.te-laat.nl_to_en",
    "type": "nl_to_en",
    "prompt": "te laat",
    "choices": ["too late", "fine", "fast"],
    "correctAnswer": "too late",
    "tags": ["kmb", "chpt-04"]
  },
  {
    "id": "a1.kmb-chpt04.no-problem.en_to_nl",
    "type": "en_to_nl",
    "prompt": "no problem",
    "choices": ["geen probleem", "te laat", "goed idee"],
    "correctAnswer": "geen probleem",
    "tags": ["kmb", "chpt-04"]
  },
  {
    "id": "a1.kmb-chpt04.mijn-broer.fill_blank",
    "type": "fill_blank",
    "prompt": "Ik heb een broer. Het is ___ broer.",
    "choices": ["mijn", "jouw", "haar"],
    "correctAnswer": "mijn",
    "tags": ["kmb", "chpt-04"]
  },
  {
    "id": "a1.kmb-chpt04.half-drie.fill_blank",
    "type": "fill_blank",
    "prompt": "Het is tien voor half ___. (2:20)",
    "choices": ["drie", "twee", "vier"],
    "correctAnswer": "drie",
    "tags": ["kmb", "chpt-04"]
  },
  {
    "id": "a1.kmb-chpt04.monique-laat.read_mcq",
    "type": "read_mcq",
    "context": "Maria wacht op Monique. Het is twee uur. Monique belt: haar bus is te laat. Zij is om kwart over twee in de stad.",
    "prompt": "Wie is te laat?",
    "choices": ["Monique", "Maria", "Irene"],
    "correctAnswer": "Monique",
    "tags": ["kmb", "chpt-04"]
  },
  {
    "id": "a1.kmb-chpt04.markt-inkopen.read_mcq",
    "type": "read_mcq",
    "context": "Monique wil appels, peren en noten kopen op de markt. Maria wil koffie, sap en fruit kopen. Zij weten ook een leuk café met lekkere taartjes.",
    "prompt": "Wat wil Monique kopen?",
    "choices": ["Appels, peren en noten", "Koffie en sap", "Een lesboek"],
    "correctAnswer": "Appels, peren en noten",
    "tags": ["kmb", "chpt-04"]
  },
  {
    "id": "a1.kmb-chpt04.afspraken.read_mcq",
    "type": "read_mcq",
    "context": "Monique heeft om half vijf een afspraak en neemt dan de tram. Maria gaat om kwart voor vijf naar de sportschool.",
    "prompt": "Hoe laat heeft Monique een afspraak?",
    "choices": ["Om half vijf", "Om kwart voor vijf", "Om twee uur"],
    "correctAnswer": "Om half vijf",
    "tags": ["kmb", "chpt-04"]
  },
  {
    "id": "a1.kmb-chpt04.kwart-over-twee.number_detail",
    "type": "number_detail",
    "context": "Monique: 'Ik ben om kwart over twee in de stad.'",
    "prompt": "Hoe laat is Monique in de stad?",
    "choices": ["Kwart over twee", "Twee uur", "Half drie"],
    "correctAnswer": "Kwart over twee",
    "tags": ["kmb", "chpt-04"]
  },
  {
    "id": "a1.kmb-chpt04.half-drie-regel.knm",
    "type": "knm",
    "prompt": "Welke zin is GOED volgens het boek?",
    "choices": ["Het is half drie.", "Het is half drie uur.", "Het is kwart voor drie uur."],
    "correctAnswer": "Het is half drie.",
    "tags": ["kmb", "chpt-04"]
  },
  {
    "id": "a1.kmb-chpt04.bus-wachten.knm",
    "type": "knm",
    "prompt": "Je vriendin is te laat omdat de bus te laat is. Wat zeg je?",
    "choices": ["Geen probleem. Ik wacht op je!", "Mag ik naar de wc?", "Ik kom uit Frankrijk."],
    "correctAnswer": "Geen probleem. Ik wacht op je!",
    "tags": ["kmb", "chpt-04"]
  }
]
